{
  "schema_version": "0.1.0",
  "image_id": "example-0001",
  "calibration": {
    "mm_per_s": 25,
    "mm_per_mv": 10,
    "px_per_mm": 8,
    "source": "default"
  },
  "sample_rate_hz": 100,
  "leads": [
    {
      "name": "II",
      "start_ms": 0,
      "amplitude_mv": [
        0.00, 0.00, 0.00, 0.00, 0.00, 0.00, 0.00, 0.00, 0.01, 0.02, 0.05, 0.09, 0.13, 0.15, 0.13, 0.09,
        0.05, 0.02, 0.01, 0.00, 0.00, 0.00, 0.00, 0.00, 0.00, -0.01, 0.00, 0.55, 1.09, 0.49, -0.10, -0.04,
        0.00, 0.00, 0.00, 0.00, 0.00, 0.00, 0.00, 0.00, 0.00, 0.00, 0.00, 0.00, 0.01, 0.01, 0.02, 0.04,
        0.07, 0.11, 0.16, 0.21, 0.25, 0.29, 0.30, 0.29, 0.25, 0.21, 0.16, 0.11, 0.07, 0.04, 0.02, 0.01,
        0.01, 0.00, 0.00, 0.00, 0.00, 0.00, 0.00, 0.00, 0.00, 0.00, 0.00, 0.00, 0.00, 0.00, 0.00, 0.00,
        0.00, 0.00, 0.00, 0.00, 0.00, 0.00, 0.00, 0.00, 0.01, 0.02, 0.05, 0.09, 0.13, 0.15, 0.13, 0.09,
        0.05, 0.02, 0.01, 0.00, 0.00, 0.00, 0.00, 0.00, 0.00, -0.01, 0.00, 0.55, 1.09, 0.49, -0.10, -0.04,
        0.00, 0.00, 0.00, 0.00, 0.00, 0.00, 0.00, 0.00, 0.00, 0.00, 0.00, 0.00, 0.01, 0.01, 0.02, 0.04,
        0.07, 0.11, 0.16, 0.21, 0.25, 0.29, 0.30, 0.29, 0.25, 0.21, 0.16, 0.11, 0.07, 0.04, 0.02, 0.01,
        0.01, 0.00, 0.00, 0.00, 0.00, 0.00, 0.00, 0.00, 0.00, 0.00, 0.00, 0.00, 0.00, 0.00, 0.00, 0.00
      ],
      "confidence": 0.92,
      "beats": [
        {
          "p": { "onset_ms": 80, "peak_ms": 130, "offset_ms": 180, "amplitude_mv": 0.15 },
          "qrs": { "onset_ms": 240, "peak_ms": 280, "offset_ms": 330, "amplitude_mv": 1.09 },
          "t": { "onset_ms": 440, "peak_ms": 540, "offset_ms": 620, "amplitude_mv": 0.30 }
        },
        {
          "p": { "onset_ms": 880, "peak_ms": 930, "offset_ms": 980, "amplitude_mv": 0.15 },
          "qrs": { "onset_ms": 1040, "peak_ms": 1080, "offset_ms": 1130, "amplitude_mv": 1.09 },
          "t": { "onset_ms": 1240, "peak_ms": 1340, "offset_ms": 1420, "amplitude_mv": 0.30 }
        }
      ]
    }
  ],
  "quality": {
    "overall_confidence": 0.9,
    "flags": []
  }
}
